{
  "$schema": "../../schemas/lab.schema.json",
  "schema_version": 1,
  "id": "001-canonical-gng",
  "title": "Canonical Growing Neural Gas",
  "status": "active",
  "research_question": "Can we reproduce canonical Growing Neural Gas topology learning with deterministic, inspectable behavior on controlled stationary distributions?",
  "owners": [
    "@abrahamabel"
  ],
  "created": "2026-07-27",
  "updated": "2026-07-27",
  "license": "MIT",
  "references": [
    {
      "type": "paper",
      "title": "A Growing Neural Gas Network Learns Topologies",
      "url": "https://proceedings.neurips.cc/paper/1994/hash/d56b9fc4b0f1be8871f5e1c40c0067e7-Abstract.html",
      "doi": null
    }
  ]
}
